sample_idx,question,answer,contexts,faithfulness,answer_relevancy,context_relevancy
439,What popular cartoon was created by a risd graduate?,"RISD graduate Seth MacFarlane created the popular cartoon Family Guy, which follows the Griffin family, and co-created the popular Family Guy spin-off cartoon The Cleveland Show and a popular cartoon in production since 2005, American Dad! MacFarlane studied film, video, and animation at the Rhode Island School of Design, or RISD, where he earned a Bachelor of Fine Arts degree.","['- (Seth MacFarlane) RISD graduate Seth MacFarlane created the popular cartoon Family Guy, which follows the Griffin family, and co-created the popular Family Guy spin-off cartoon The Cleveland Show and a popular cartoon in production since 2005, American Dad! MacFarlane studied film, video, and animation at the Rhode Island School of Design, or RISD, where he earned a Bachelor of Fine Arts degree.\r\n- (QA_1) What popular Family Guy spin-off cartoon was created by a RISD graduate? The Cleveland Show.\r\n- (QA_2) What popular cartoon in production since 2005 was created by a RISD graduate? American Dad!.\r\n- (QA_3) What popular cartoon following the Griffin family was created by a RISD grad? Family Guy.']",1.0,0.6929763109941423,0.2222222222222222
440,Who does the voice of sanjay and craig?,"On the show Sanjay and Craig, Sanjay Patel is voiced by Maulik Pancholy. Craig Slithers, Sanjay's best friend and pet boa constrictor, is voiced by Chris Hardwick. ","[""- (Sanjay and Craig) On the show Sanjay and Craig, Sanjay Patel is voiced by Maulik Pancholy. Craig Slithers, Sanjay's best friend and pet boa constrictor, is voiced by Chris Hardwick.\r\n- (QA_1) Who does the voice of Sanjay in the show Sanjay and Craig? Maulik Pancholy.\r\n- (QA_2) Who does the voice of Craig in the show Sanjay and Craig? Chris Hardwick.""]",1.0,0.8609328308203844,0.3333333333333333
441,When do haley and nathan get back together season 3?,"One Tree Hill is an American drama television series that follows the lives of two half-brothers, Lucas and Nathan Scott. In the show, Nathan and Haley develop a relationship but Nathan ends up filing for divorce. They get back together in season 3, episode 10, which is called ""Brave New World"".","['- (QA_1) What number episode do haley and nathan get back together season 3? 10.\r\n- (QA_2) What is the name of the episode that haley and nathan get back together season 3? ""Brave New World"".']",0.2857142857142857,0.751503591337138,1.0
442,Mexico is led by a chief of state who is?,"The president of Mexico is the head of state and head of government of Mexico. Under the Constitution of Mexico, the President is the chief of the executive branch of the federal government and is the commander in chief of the Mexican Armed Forces. The current president is Andrés Manuel López Obrador, who took office on 1 December 2018. Enrique Peña Nieto was President from 2012 to 2018, Felipe de Jesús Calderón Hinojosa was President from 2006 to 2012, and Vicente Fox Quesada was President from 2000 to 2006. Mexican presidents are limited to a single six-year term.","['- (President of Mexico) The president of Mexico is the head of state and head of government of Mexico. Under the Constitution of Mexico, the President is the chief of the executive branch of the federal government and is the commander in chief of the Mexican Armed Forces. The current president is Andrés Manuel López Obrador, who took office on 1 December 2018. Enrique Peña Nieto was President from 2012 to 2018, Felipe de Jesús Calderón Hinojosa was President from 2006 to 2012, and Vicente Fox Quesada was President from 2000 to 2006. Mexican presidents are limited to a single six-year term.\r\n- (QA_1) Mexico is led by a chief of state whose title is? president of Mexico, president of the United Mexican States.\r\n- (QA_2) Mexico is led by which chief of state from 2012 to 2018? Enrique Peña Nieto, EPN.\r\n- (QA_3) Mexico is led by which chief of state from 2006 to 2012? Felipe de Jesús Calderón Hinojosa, Felipe Calderón.']",1.0,0.6975552525236871,0.18181818181818182
443,Who created the declaration of the rights of man?,"The Declaration of the Rights of Man and of the Citizen, set by France's National Constituent Assembly in 1789, is a human civil rights document from the French Revolution. The content of the document emerged largely from the ideals of the Enlightenment. The principal drafts were prepared by Lafayette, working at times with his close friend Thomas Jefferson. In August 1789, the Abbé Sieyès and Honoré Mirabeau played a central role in conceptualizing and drafting the final Declaration of the Rights of Man and of the Citizen. The Declaration of the Rights of Man painting was created by Jean-Jacques-François Le Barbier. The Declaration of the Rights of the Man and of the Citizen of 1793 was written by the commission that included Louis Antoine Léon de Saint-Just and Marie-Jean Hérault de Séchelles. It included new rights and revisions to prior ones. It was officially adopted on 10 August but never went into effect.","[""- (Declaration of the Rights of Man and of the Citizen) The Declaration of the Rights of Man and of the Citizen, set by France's National Constituent Assembly in 1789, is a human civil rights document from the French Revolution. The content of the document emerged largely from the ideals of the Enlightenment. The principal drafts were prepared by Lafayette, working at times with his close friend Thomas Jefferson. In August 1789, the Abbé Sieyès and Honoré Mirabeau played a central role in conceptualizing and drafting the final Declaration of the Rights of Man and of the Citizen. The Declaration of the Rights of Man painting was created by Jean-Jacques-François Le Barbier. The Declaration of the Rights of the Man and of the Citizen of 1793 was written by the commission that included Louis Antoine Léon de Saint-Just and Marie-Jean Hérault de Séchelles. It included new rights and revisions to prior ones. It was officially adopted on 10 August but never went into effect.\r\n- (QA_1) Who created the painting declaration of the rights of man? Jean-Jacques-François Le Barbier.\r\n- (QA_2) Who drafted the declaration of the rights of man of 1789? Marquis de Lafayette, Honoré Mirabeau, Abbé Sieyès, Thomas Jefferson.\r\n- (QA_3) Who set the declaration of the rights of man in 1789? National Constituent Assembly.""]",1.0,0.8188976756318022,0.21428571428571427
444,When is the second big hero 6 coming out?,"Big Hero 6: The Series is an American animated television series developed for Disney Television Animation. Taking place after the events of the film, the show follows the continuing adventures of Hiro Hamada and his robot companion Baymax who, together with their friends, fight crime in the city of San Fransokyo. The second episode of the show came out on June 9, 2018 and the second season came out on May 6, 2019.","['- (List of Big Hero 6: The Series episodes) Big Hero 6: The Series is an American animated television series developed for Disney Television Animation. Taking place after the events of the film, the show follows the continuing adventures of Hiro Hamada and his robot companion Baymax who, together with their friends, fight crime in the city of San Fransokyo. The second episode of the show came out on June 9, 2018 and the second season came out on May 6, 2019.\r\n- (QA_1) When is the second episode of big hero 6 coming out? June 9, 2018.\r\n- (QA_2) When is the second season of big hero 6 coming out? May 6, 2019.']",1.0,0.5255642101176666,0.0
445,When were fundamental duties added to the indian constitution?,"The Fundamental Rights, Directive Principles of State Policy and Fundamental Duties' are sections of the Constitution of India that prescribe the fundamental obligations of the states to its citizens and the duties and the rights of the citizens to the State. These sections are considered vital elements of the constitution, which was developed between 1947 and 1949 by the Constituent Assembly of India. The ten original fundamental duties were added to the constitution by the 42nd Amendment in 1976 and came into effect on 3 January 1977. The fundamental duties were increased to eleven by the 86th Amendment on 12 December 2002, which added a duty on every parent or guardian to ensure that their child or ward was provided opportunities for education between the ages of six and fourteen years. ","['- (QA_1) When were the ten original fundamental duties passed and added to the indian constitution? 1976, 11 November 1976.\r\n- (QA_2) When was the additional fundamental duty added to the indian constitution and enforced, bringing the number of fundamental duties to eleven? 2002, 12 December 2002.\r\n- (QA_3) When did the ten original fundamental duties of the indian constitution come into effect? 3 January 1977.']",0.3,0.5861624096987006,0.3333333333333333
446,Who sang this time i know its for real?,"This Time I Know It's for Real is a song originally recorded by Donna Summer and released on February 13, 1989 as the first single from her album Another Place and Time by Atlantic Records and Warner Bros. Records. It became Summer's biggest hit in the UK since the 1970s, reaching number three and spending a total of 14 weeks in the Top 75, longer than any of her other singles there. Australian girl group Young Divas covered This Time I Know It's for Real to coincide with nationwide tour dates from July to August 2006. The song was released as a CD single on May 6, 2006 to attract attention for the tour.","[""- (This Time I Know It's for Real) This Time I Know It's for Real is a song originally recorded by Donna Summer and released on February 13, 1989 as the first single from her album Another Place and Time by Atlantic Records and Warner Bros. Records. It became Summer's biggest hit in the UK since the 1970s, reaching number three and spending a total of 14 weeks in the Top 75, longer than any of her other singles there. Australian girl group Young Divas covered This Time I Know It's for Real to coincide with nationwide tour dates from July to August 2006. The song was released as a CD single on May 6, 2006 to attract attention for the tour.\r\n- (QA_1) Who sang the original version of This Time I Know it's for Real? Donna Summer.\r\n- (QA_2) What Australian girl group released a CD single of This time I Know it's for Real? Young Divas.""]",1.0,0.6719243064903416,0.3333333333333333
447,Where was the world war 1 armistice signed?,"Armistice Day is commemorated every year on 11 November to mark the armistice signed between the Allies of World War I and Germany at Le Francport near  Compiègne, France. It took effect at eleven o'clock in the morning—the ""eleventh hour of the eleventh day of the eleventh month"" of 1918. The Armistice of Mudros ended hostilities in the Middle Eastern theatre between the Ottoman Empire and the Allies of World War I. It was signed on board HMS Agamemnon in Moudros harbor on the Greek island of Lemnos. The Armistice of Villa Giusti or Padua ended warfare between Italy and Austria-Hungary on the Italian Front during World War I. The armistice was signed in the Villa Giusti, outside Padua in the Veneto, Northern Italy.","['- (QA_1) Where was the world war 1 armistice of mudros signed? Moudros harbor, Greek island of Lemnos., HMS Agamemnon.\r\n- (QA_2) Where was the world war 1 Austrian-Italian Armistice of Villa Giusti signed? Veneto, Northern Italy, outside Padua, Villa Giusti.\r\n- (QA_3) Where was the world war 1 armistice Armistice with Germany (Compiègne) signed? Le Francport near Compiègne, France.']",0.38461538461538464,0.4855472305217879,0.7142857142857143
448,Who played the lion in the wizard of oz?,"The Wizard of Oz film released in 1925 is a silent fantasy-adventure comedy film and is the only completed 1920s adaptation of L. Frank Baum's 1900 novel The Wonderful Wizard of Oz. In this film, the Cowardly Lion was played in disguise by Spencer Bell, who was one of the first African American comedic actors of the silent film era and was the first to be signed to film contract. The Wizard of Oz film released in 1939 is a musical fantasy film produced by Metro-Goldwyn-Mayer. Often seen as one of the greatest films of all time, it is the most commercially successful adaptation of L. Frank Baum's 1900 children's fantasy novel The Wonderful Wizard of Oz. In this film, Bert Lahr, a popular vaudeville and Broadway star, played the role of the Cowardly Lion.",['- (QA_1) Who played the Lion in The Wizard of Oz (1925)? Spencer Bell.\r\n- (QA_2) Who played the Lion in The Wizard of Oz (1939)? Bert Lahr.'],0.23076923076923078,0.8370293177910054,1.0
449,What year did the first thor come out?,"Thor debuted as a Marvel Comics superhero in the science fiction/fantasy anthology title ""Journey into Mystery"" #83 in August 1962. A version of Thor was created for D.C. Comics before this, which was included in ""Tales of the Unexpected"" #16, released in 1957. Thor starred in the segment ""The Mighty Thor"" of the animated The Marvel Super Heroes, originally syndicated in 1966. Thor was first portrayed in live action by Eric Allan Kramer in the 1988 television movie The Incredible Hulk Returns. The first Thor film by Marvel Studios came out in 2011.",['- (QA_1) What year did Thor first come out as a character in the Marvel Comics? 1962.\r\n- (QA_2) What year did Thor first come out in the DC Comics? 1957.\r\n- (QA_3) What year did the first Thor film by Marvel Studios come out? 2011.'],0.2727272727272727,0.7611207340952822,0.3333333333333333
450,Who played the phantom of the opera in 1986?,"The Phantom of the Opera opened in London's West End in 1986 and on Broadway in 1988. Michael Patrick Smith, known professionally as Michael Crawford, starred as the phantom in the West End version and the Broadway version. Anthony Warlow played the phantom in the 1986 Australian version. Brent Barrett and Anthony Crivello played the phantom in the 1986 Las Vegas version.","['- (QA_1) Who played the phantom of the opera in 1986 on Broadway? Michael Patrick Smith, Michael Crawford, Crawford.\r\n- (QA_2) Who played the phantom of the opera in 1986 in Australia? Warlow, Anthony Warlow.\r\n- (QA_3) Who played the phantom of the opera in 1986 in Las Vegas? Brent Barrett and Anthony Crivello, Barrett, Crivello, Anthony Crivello, Brent Barrett.']",0.5,0.6266699362129547,0.5
451,Who wrote the song what do you want from me?,"What Do You Want from Me is a song by Pink Floyd featured on their 1994 album, The Division Bell. It was written by David Gilmour, Polly Samson, and Richard Wright. What Do You Want from Me? is also a song written by Peter Hook, David Potts, and was made for Hook's band Monaco. It was released in 1997 from the band's debut album, Music for Pleasure. What Do You Want from Me? is also a 2007 song recorded by Cascada. This song was written by Tony Cornelissen, Manuel Reuter & Yann Peifer. What Do You Want from Me is also a single by Forever the Sickest Kids released in 2009. This song was written by Austin Bello, Caleb Turman, Shep Goodman. Whataya Want from Me is a song by American Idol eighth season runner-up Adam Lambert. It was written by Alecia Moore, Max Martin, Johan Schuster.","['- (Whataya Want from Me) What Do You Want from Me is a song by Pink Floyd featured on their 1994 album, The Division Bell. It was written by David Gilmour, Polly Samson, and Richard Wright. What Do You Want from Me? is also a song written by Peter Hook, David Potts, and was made for Hook\'s band Monaco. It was released in 1997 from the band\'s debut album, Music for Pleasure. What Do You Want from Me? is also a 2007 song recorded by Cascada. This song was written by Tony Cornelissen, Manuel Reuter & Yann Peifer. What Do You Want from Me is also a single by Forever the Sickest Kids released in 2009. This song was written by Austin Bello, Caleb Turman, Shep Goodman. Whataya Want from Me is a song by American Idol eighth season runner-up Adam Lambert. It was written by Alecia Moore, Max Martin, Johan Schuster.\r\n- (What Do You Want from Me (Pink Floyd song)) What Do You Want from Me is a song by Pink Floyd featured on their 1994 album, The Division Bell. It was written by David Gilmour, Polly Samson, and Richard Wright. What Do You Want from Me? is also a song written by Peter Hook, David Potts, and was made for Hook\'s band Monaco. It was released in 1997 from the band\'s debut album, Music for Pleasure. What Do You Want from Me? is also a 2007 song recorded by Cascada. This song was written by Tony Cornelissen, Manuel Reuter & Yann Peifer. What Do You Want from Me is also a single by Forever the Sickest Kids released in 2009. This song was written by Austin Bello, Caleb Turman, Shep Goodman. Whataya Want from Me is a song by American Idol eighth season runner-up Adam Lambert. It was written by Alecia Moore, Max Martin, Johan Schuster.\r\n- (What Do You Want from Me? (Monaco song)) What Do You Want from Me is a song by Pink Floyd featured on their 1994 album, The Division Bell. It was written by David Gilmour, Polly Samson, and Richard Wright. What Do You Want from Me? is also a song written by Peter Hook, David Potts, and was made for Hook\'s band Monaco. It was released in 1997 from the band\'s debut album, Music for Pleasure. What Do You Want from Me? is also a 2007 song recorded by Cascada. This song was written by Tony Cornelissen, Manuel Reuter & Yann Peifer. What Do You Want from Me is also a single by Forever the Sickest Kids released in 2009. This song was written by Austin Bello, Caleb Turman, Shep Goodman. Whataya Want from Me is a song by American Idol eighth season runner-up Adam Lambert. It was written by Alecia Moore, Max Martin, Johan Schuster.\r\n- (What Do You Want from Me? (Cascada song)) What Do You Want from Me is a song by Pink Floyd featured on their 1994 album, The Division Bell. It was written by David Gilmour, Polly Samson, and Richard Wright. What Do You Want from Me? is also a song written by Peter Hook, David Potts, and was made for Hook\'s band Monaco. It was released in 1997 from the band\'s debut album, Music for Pleasure. What Do You Want from Me? is also a 2007 song recorded by Cascada. This song was written by Tony Cornelissen, Manuel Reuter & Yann Peifer. What Do You Want from Me is also a single by Forever the Sickest Kids released in 2009. This song was written by Austin Bello, Caleb Turman, Shep Goodman. Whataya Want from Me is a song by American Idol eighth season runner-up Adam Lambert. It was written by Alecia Moore, Max Martin, Johan Schuster.\r\n- (QA_1) Who wrote the song ""What Do You Want From Me?"" by Pink Floyd? David Gilmour, Polly Samson.\r\n- (QA_2) Who wrote the song ""What Do You Want From Me?"" by Monaco? Peter Hook, David Potts.\r\n- (QA_3) Who wrote the song ""What Do You Want From Me?"" by Cascada? Tony Cornelissen, Manuel Reuter & Yann Peifer.']",1.0,0.0,0.07142857142857142
452,When did the queen became the queen of the uk?,"The current monarch of the United Kingdom is Queen Elizabeth II, who ascended the throne on 6 February 1952. She has reigned as a constitutional monarch through major political changes, such as devolution in the United Kingdom, accession of the United Kingdom to the European Communities, Brexit, Canadian patriation, and the decolonization of Africa. Elizabeth is the longest-lived and longest-reigning British monarch as well as the oldest and longest-serving current head of state. Queen Victoria became the Queen of the United Kingdom on 20 June 1837 and remained Queen until her death in 1901. Known as the Victorian era, her reign of 63 years and seven months was longer than any previous British monarch. It was a period of industrial, political, scientific, and military change within the United Kingdom, and was marked by a great expansion of the British Empire.","['- (Monarchy of the United Kingdom) The current monarch of the United Kingdom is Queen Elizabeth II, who ascended the throne on 6 February 1952. She has reigned as a constitutional monarch through major political changes, such as devolution in the United Kingdom, accession of the United Kingdom to the European Communities, Brexit, Canadian patriation, and the decolonization of Africa. Elizabeth is the longest-lived and longest-reigning British monarch as well as the oldest and longest-serving current head of state. Queen Victoria became the Queen of the United Kingdom on 20 June 1837 and remained Queen until her death in 1901. Known as the Victorian era, her reign of 63 years and seven months was longer than any previous British monarch. It was a period of industrial, political, scientific, and military change within the United Kingdom, and was marked by a great expansion of the British Empire.\r\n- (Elizabeth II) The current monarch of the United Kingdom is Queen Elizabeth II, who ascended the throne on 6 February 1952. She has reigned as a constitutional monarch through major political changes, such as devolution in the United Kingdom, accession of the United Kingdom to the European Communities, Brexit, Canadian patriation, and the decolonization of Africa. Elizabeth is the longest-lived and longest-reigning British monarch as well as the oldest and longest-serving current head of state. Queen Victoria became the Queen of the United Kingdom on 20 June 1837 and remained Queen until her death in 1901. Known as the Victorian era, her reign of 63 years and seven months was longer than any previous British monarch. It was a period of industrial, political, scientific, and military change within the United Kingdom, and was marked by a great expansion of the British Empire.\r\n- (QA_1) When did Queen Elizabeth II become Queen of the UK? 6 February 1952.\r\n- (QA_2) When did Queen Victoria become Queen of the UK? 20 June 1837.']",1.0,0.6434062868603259,0.0625
453,When was the last year we had a total eclipse of the sun?,"A total solar eclipse occurs when the Moon's apparent diameter is larger than the Sun's, blocking all direct sunlight, turning day into darkness. Totality occurs in a narrow path across Earth's surface, with a partial solar eclipse visible over a surrounding region thousands of kilometers wide. The last year a total solar eclipse was visible in the US was in 2017, which spanned the entire contiguous United States. Prior to this event, no solar eclipse had been visible across the entire United States since 1918. The last time a total solar eclipse was visible from the Faroe Islands, Svalbard, the North Atlantic, the North Pole, and the UK was in 2015. The last time a total solar eclipse was visible from Indonesia, Micronesia, and the Marshall Islands was in 2016.","['- (QA_1) When was the last year a total eclipse of the sun was visible in the United States? 2017.\r\n- (QA_2) When was the last year a total eclipse of the sun was visible in the United States since 2017? 1918.\r\n- (QA_3) When was the last year a total eclipse of the sun was visible from Indonesia, Micronesia, and Marshall Islands? 2016.']",0.3,0.593411348598702,1.0
454,Total us debt as a percentage of gdp?,"The national debt of the United States is the total national debt owed by the federal government of the United States to Treasury security holders. Historically, the U.S. public debt as a share of gross domestic product (GDP) increases during wars and recessions and then subsequently declines. At the end of President Bush's first term, total debt as a percentage of GDP was 63.5%, which increased to 84.2% at the end of his second term. At the end of President Obama's first term, total debt as a percentage of GDP was 102.7%.","[""- (National debt of the United States) The national debt of the United States is the total national debt owed by the federal government of the United States to Treasury security holders. Historically, the U. S. public debt as a share of gross domestic product (GDP) increases during wars and recessions and then subsequently declines. At the end of President Bush's first term, total debt as a percentage of GDP was 63. 5%, which increased to 84. 2% at the end of his second term. At the end of President Obama's first term, total debt as a percentage of GDP was 102. 7%.\r\n- (QA_1) Total us debt as a percentage of gdp at the end of Obama's first presidency? 102.7.\r\n- (QA_2) Total us debt as a percentage of gdp at the end of Bush's first presidency? 63.5.\r\n- (QA_3) Total us debt as a percentage of gdp at the end of Bush's second presidency? 84.2.""]",1.0,0.5998613116310674,0.38461538461538464
