sample_idx,question,answer,contexts,faithfulness,answer_relevancy,context_relevancy
284,Who has played the most games in the premier league?,"Gareth Barry has made 653 Premier League appearances, making his the player with the most games in the premier league. Manchester United have won more trophies than any other club in English football, with a record 20 League titles, 12 FA Cups, five League Cups and a record 21 FA Community Shields.","['- (Premier League records and statistics) Gareth Barry has made 653 Premier League appearances, making his the player with the most games in the premier league. Manchester United have won more trophies than any other club in English football, with a record 20 League titles, 12 FA Cups, five League Cups and a record 21 FA Community Shields.\r\n- (QA_1) Who is the player that has played the most games in the premier league? Barry, Gareth Barry.\r\n- (QA_2) Who are the teams that have played the most games in the premier league? Manchester United, Manchester United, Arsenal, Chelsea, Liverpool, Tottenham Hotspur, and Everton, Chelsea, Tottenham Hotspur, Liverpool, Arsenal, Everton.']",1.0,0.8226405057189122,0.16666666666666666
285,How many sports are there in the 2018 commonwealth games?,"The 2018 Commonwealth Games featured 18 different sports encompassing 23 disciplines and 275 events. The approved sports included the 10 core sports: athletics, badminton, boxing, hockey, lawn bowls, netball (for women), rugby sevens, squash, swimming and weightlifting.","['- (2018 Commonwealth Games) The 2018 Commonwealth Games featured 18 different sports encompassing 23 disciplines and 275 events. The approved sports included the 10 core sports: athletics, badminton, boxing, hockey, lawn bowls, netball (for women), rugby sevens, squash, swimming and weightlifting.\r\n- (QA_1) How many core core sports were at the 2018 Commonwealth games? 10.\r\n- (QA_2) How many non core core sports were at the 2018 Commonwealth games? 8.\r\n- (QA_3) How many sports total were at the 2018 Commonwealth games? 18.']",1.0,0.846290965909633,0.375
286,What are the products that result from the light reactions of photosynthesis?,"02, NADPH and ATP are the products that result from the light reactions of oxygenic photosynthesis. Sulfur, NADH, and ATP result from the light reactions of photosynthesis by green sulfur bacteria.","['- (Light-dependent reactions) 02, NADPH and ATP are the products that result from the light reactions of oxygenic photosynthesis. Sulfur, NADH, and ATP result from the light reactions of photosynthesis by green sulfur bacteria.\r\n- (QA_1) What are the products that result from the light reactions of oxygenic photosynthesis? O2, NADPH, ATP.\r\n- (QA_2) What are the products that result from the light reactions of photosynthesis by green sulfur bacteria? sulfur, NADH, ATP.']",1.0,0.7024436334918106,0.3333333333333333
287,How many times has the us congress declared war?,"The United States has formally declared war against foreign nations five separate times, each upon prior request by the President of the United States. The only country against which the United States has declared war more than once is Germany, against which the United States has declared war twice.","['- (Declaration of war by the United States) The United States has formally declared war against foreign nations five separate times, each upon prior request by the President of the United States. The only country against which the United States has declared war more than once is Germany, against which the United States has declared war twice.\r\n- (QA_1) How many times did the US Congress declare war, for separate wars? 5.\r\n- (QA_2) How many times did the US Congress declare war, counting each country separately? 11.']",1.0,0.8211112150422585,0.16666666666666666
288,When does the regular season of nhl start?,"The 2015–16 NHL season of the National Hockey League (NHL) started October 7, 2015. The 2016–17 NHL season started October 12, 2016 and the 2017–18 NHL season started October 4, 2017","['- (2017–18 NHL season) The 2015–16 NHL season of the National Hockey League (NHL) started October 7, 2015. The 2016–17 NHL season started October 12, 2016 and the 2017–18 NHL season started October 4, 2017.\r\n- (2015–16 NHL season) The 2015–16 NHL season of the National Hockey League (NHL) started October 7, 2015. The 2016–17 NHL season started October 12, 2016 and the 2017–18 NHL season started October 4, 2017.\r\n- (2016–17 NHL season) The 2015–16 NHL season of the National Hockey League (NHL) started October 7, 2015. The 2016–17 NHL season started October 12, 2016 and the 2017–18 NHL season started October 4, 2017.\r\n- (QA_1) When does the 2017-2018 regular season of nhl start? October 4, 2017.\r\n- (QA_2) When does the 2016-2017 regular season of nhl start? October 12, 2016.\r\n- (QA_3) When does the 2015-2016 regular season of nhl start? October 7, 2015.']",1.0,0.7175505731100044,0.25
289,When did system of a down come out?,"System of a Down is an Armenian-American heavy metal band formed in Glendale, California, in 1994. In June 1998, System of a Down released their debut album, System of a Down. ","['- (System of a Down) System of a Down is an Armenian-American heavy metal band formed in Glendale, California, in 1994. In June 1998, System of a Down released their debut album, System of a Down.\r\n- (QA_1) When did system of a down form as a band? 1994.\r\n- (QA_2) When did the album, system of a down, come out? June 30, 1998.\r\n- (QA_3) When did System of a Down (band) form? 1994.']",1.0,0.8431792699369315,0.25
290,Who has the biggest state fair in the usa?,"As of 2019, the largest attendance at a state fair in the USA is in Minnesota attracting 2,126,551 visitors. The largest average per day attendance is also at the Minnesota State Fair averaging just under 200,000 people per day.","['- (State fair) As of 2019, the largest attendance at a state fair in the USA is in Minnesota attracting 2,126,551 visitors. The largest average per day attendance is also at the Minnesota State Fair averaging just under 200,000 people per day.\r\n- (QA_1) What state has the biggest state fair by attendance? Texas.\r\n- (QA_2) What state has the biggest state fair by percentage of total state population? Alaska.']",1.0,0.8456519886983246,0.3333333333333333
291,When did construction start on the great wall of china?," First versions of the great wall of china date back to 771-476 bc during pre-imperial china. The Great Wall of China visible today largely dates from the Ming dynasty, 1368-1644.","['- (History of the Great Wall of China) First versions of the great wall of china date back to 771-476 bc during pre-imperial china. The Great Wall of China visible today largely dates from the Ming dynasty, 1368-1644.\r\n- (QA_1) When did construction start on the first versions of the great wall of china? 771–476 bc, Pre-imperial China, 771 BC.\r\n- (QA_2) When did construction start on most parts of the great wall of china visible today? 1368–1644, Ming dynasty.']",1.0,0.8089729249644456,0.3333333333333333
292,Who sings hawaiian version of somewhere over the rainbow?," I've found multiple people who have sung the hawaiian version of ""somewhere over the rainbow"" including the original singer Israel Kamakawiwo'ole. I found a cover of the song in Cliff Richard 2001 album ""Wanted"" and also in Aselin Debison 2002 album ""Sweet is the Melody''and Elisabeth Von Trapp in her 2004 album ""Poetic License."" Jason Castro sang ""Somewhere over the rainbow"" in season 7 of American Idol and Maddie Poppe and Caleb Lee Hutchinson sang the song in season sixteen of American Idol. ","['- (Somewhere Over the Rainbow/What a Wonderful World) I\'ve found multiple people who have sung the hawaiian version of ""somewhere over the rainbow"" including the original singer Israel Kamakawiwo\'ole. I found a cover of the song in Cliff Richard 2001 album ""Wanted"" and also in Aselin Debison 2002 album ""Sweet is the Melody\'\'and Elisabeth Von Trapp in her 2004 album ""Poetic License. "" Jason Castro sang ""Somewhere over the rainbow"" in season 7 of American Idol and Maddie Poppe and Caleb Lee Hutchinson sang the song in season sixteen of American Idol.\r\n- (Israel Kamakawiwoʻole) I\'ve found multiple people who have sung the hawaiian version of ""somewhere over the rainbow"" including the original singer Israel Kamakawiwo\'ole. I found a cover of the song in Cliff Richard 2001 album ""Wanted"" and also in Aselin Debison 2002 album ""Sweet is the Melody\'\'and Elisabeth Von Trapp in her 2004 album ""Poetic License. "" Jason Castro sang ""Somewhere over the rainbow"" in season 7 of American Idol and Maddie Poppe and Caleb Lee Hutchinson sang the song in season sixteen of American Idol.\r\n- (QA_1) Who sings the Hawaiian version of ""Somewhere Over the Rainbow"" released in 1990? Israel Kamakawiwo\'ole.\r\n- (QA_2) Who sings a cover of the Hawaiian version of ""Somewhere Over the Rainbow"" in their 2001 album Wanted? Cliff Richard.\r\n- (QA_3) Who sings a cover of the Hawaiian version of ""Somewhere Over the Rainbow"" in their 2002 album Sweet Is the Melody? Aselin Debison.']",1.0,0.8946729924552889,0.25
293,Where is the new double dare filmed at?,"The new version of Double Dare was filmed at CBS Studio Center. In celebration of Super Bowl LIII, a special 45-minute episode featuring stars of Nickelodeon comedy ""Cousins for Life"" and NFL players was recorded on January 31, 2019 at the Georgia World Congress Center in Atlanta, as part of the Super Bowl Experience.","['- (Double Dare (franchise)) The new version of Double Dare was filmed at CBS Studio Center. In celebration of Super Bowl LIII, a special 45-minute episode featuring stars of Nickelodeon comedy ""Cousins for Life"" and NFL players was recorded on January 31, 2019 at the Georgia World Congress Center in Atlanta, as part of the Super Bowl Experience.\r\n- (QA_1) Where is the new version of Double Dare filmed at? CBS Studio Center.\r\n- (QA_2) Where was the Super Bowl LII special of the new Double Dare filmed at? Georgia World Congress Center.']",1.0,0.8566787851192404,0.16666666666666666
294,When was the last time the miami dolphins were in the playoffs?,"The Miami Dolphins were last in the playoffs on January 8, 2017. Prior to that, there last time in the playoffs was January 4, 2009.","['- (List of Miami Dolphins seasons) The Miami Dolphins were last in the playoffs on January 8, 2017. Prior to that, there last time in the playoffs was January 4, 2009.\r\n- (QA_1) When was the last time the miami dolphins were in the playoffs, as of 2017? January 8, 2017.\r\n- (QA_2) When was the last time the miami dolphins were in the playoffs, as of 2016? January 4, 2009.\r\n- (QA_3) When was the last time the miami dolphins were in the playoffs, as of 2015? January 4, 2009.']",1.0,0.9299627785706744,0.125
295,Most goals in one nhl game by a player?,"The first player to score five or more goals in a single game so was Joe Malone, with the Montreal Canadiens, in the first NHL game, on December 19, 1917. He is the only player in the history of the NHL to score seven goals in a single game, accomplishing the feat in 1920.","['- (List of players with five or more goals in an NHL game) The first player to score five or more goals in a single game so was Joe Malone, with the Montreal Canadiens, in the first NHL game, on December 19, 1917. He is the only player in the history of the NHL to score seven goals in a single game, accomplishing the feat in 1920.\r\n- (QA_1) Most goals scored in one nhl game by a player? 7.\r\n- (QA_2) Most goals in one nhl game by which player? Joe Malone.']",1.0,0.7667648672668154,0.5
296,Who is the head of the nation in india?,"Pratibha Patil served as the 12th President of India from 2007 to 2012. A member of the Indian National Congress, Patil is the only woman to have held the office. Pranab Mukherjee served as the 13th President of India from 2012 until 2017. Ram Nath Kovind is serving as the 14th and current president of India since his inauguration in 2017. ","['- (Pranab Mukherjee) Pratibha Patil served as the 12th President of India from 2007 to 2012. A member of the Indian National Congress, Patil is the only woman to have held the office. Pranab Mukherjee served as the 13th President of India from 2012 until 2017. Ram Nath Kovind is serving as the 14th and current president of India since his inauguration in 2017.\r\n- (Pratibha Patil) Pratibha Patil served as the 12th President of India from 2007 to 2012. A member of the Indian National Congress, Patil is the only woman to have held the office. Pranab Mukherjee served as the 13th President of India from 2012 until 2017. Ram Nath Kovind is serving as the 14th and current president of India since his inauguration in 2017.\r\n- (QA_1) Who is the 14th president in india? Ram Nath Kovind.\r\n- (QA_2) Who is the 13th president in india? Pranab Mukherjee.\r\n- (QA_3) Who is the 12th president in india? Pratibha Devisingh Patil, Pratibha Patil.']",1.0,0.5204052399630309,0.07142857142857142
297,When did the simpsons first air on television?,"The Simpsons first appeared as shorts in ""The Tracey Ullman Show"" on April 19, 1987. In 1989, a team of production companies adapted ""The Simpsons"" into a half-hour series for the Fox Broadcasting Company. The half-hour series premiered on December 17, 1989, with ""Simpsons Roasting on an Open Fire"".","['- (The Simpsons) The Simpsons first appeared as shorts in ""The Tracey Ullman Show"" on April 19, 1987. In 1989, a team of production companies adapted ""The Simpsons"" into a half-hour series for the Fox Broadcasting Company. The half-hour series premiered on December 17, 1989, with ""Simpsons Roasting on an Open Fire"".\r\n- (QA_1) When did the Simpsons first air on television as an animated short on the Tracey Ullman Show? April 19, 1987.\r\n- (QA_2) When did the Simpsons first air as a half-hour prime time show? December 17, 1989.']",0.75,0.758005698842266,0.2857142857142857
298,When does mama mia 2 come out in the uk?,"""Mamma Mia! Here We Go Again"" was premiered at the Hammersmith Apollo in London on July 16, 2018, and was released in the United Kingdom and the United States on July 20, 2018.","['- (Mamma Mia! Here We Go Again) ""Mamma Mia! Here We Go Again"" was premiered at the Hammersmith Apollo in London on July 16, 2018, and was released in the United Kingdom and the United States on July 20, 2018.\r\n- (QA_1) When does Mama Mia 2 come out at the Hammersmith Apollo? July 16, 2018.\r\n- (QA_2) When does Mama Mia 2 come out throughout the UK? July 20, 2018.']",1.0,0.6413616603651536,0.6
299,Who is the new chairman senate of pakistan?,Farooq Naek became Chairman of the Senate of Pakistan in 2009. Nayyar Bukhari served as the 6th Chairman of the Senate of Pakistan from March 2012 to March 2015. Raza Rabbani was elected as the 7th Chairman of the Senate of Pakistan from March 2015 to March 2018.,['- (QA_1) Who is the Chairman of the Senate of Pakistan in 2017? Raza Rabbani.\r\n- (QA_2) Who is the Chairman of the Senate of Pakistan in 2014? Nayyar Bukhari.\r\n- (QA_3) Who is the Chairman of the Senate of Pakistan in 2011? Farooq Naek.'],0.3333333333333333,0.8504929014404543,0.16666666666666666
300,When did the song say my name come out?,"There are several songs titled ""Say My Name"" including ""Say My Name"" by Destiny's Child which was released on November 7, 1999. ""Say My Name"" is also a song by French DJ David Guetta, American singer-songwriter Bebe Rexha and Colombian singer J Balvin. It was released as the eighth single from Guetta's album 7 on October 26, 2018. ""Say My Name"" is also a song performed by Swedish singer Tove Styrke from her third studio album, Sway (2018). It was released as the album's lead single on April 28, 2017. ""Say My Name"" is also a song by Australian electronic music duo Peking Duk. It is the first single from the group to be released in the United States and is taken from their first extended play, Songs to Sweat To, to be released on July 31 2015.","['- (Say My Name) There are several songs titled ""Say My Name"" including ""Say My Name"" by Destiny\'s Child which was released on November 7, 1999. ""Say My Name"" is also a song by French DJ David Guetta, American singer-songwriter Bebe Rexha and Colombian singer J Balvin. It was released as the eighth single from Guetta\'s album 7 on October 26, 2018. ""Say My Name"" is also a song performed by Swedish singer Tove Styrke from her third studio album, Sway (2018). It was released as the album\'s lead single on April 28, 2017. ""Say My Name"" is also a song by Australian electronic music duo Peking Duk. It is the first single from the group to be released in the United States and is taken from their first extended play, Songs to Sweat To, to be released on July 31 2015.\r\n- (Say My Name (Tove Styrke song)) There are several songs titled ""Say My Name"" including ""Say My Name"" by Destiny\'s Child which was released on November 7, 1999. ""Say My Name"" is also a song by French DJ David Guetta, American singer-songwriter Bebe Rexha and Colombian singer J Balvin. It was released as the eighth single from Guetta\'s album 7 on October 26, 2018. ""Say My Name"" is also a song performed by Swedish singer Tove Styrke from her third studio album, Sway (2018). It was released as the album\'s lead single on April 28, 2017. ""Say My Name"" is also a song by Australian electronic music duo Peking Duk. It is the first single from the group to be released in the United States and is taken from their first extended play, Songs to Sweat To, to be released on July 31 2015.\r\n- (Say My Name (Peking Duk song)) There are several songs titled ""Say My Name"" including ""Say My Name"" by Destiny\'s Child which was released on November 7, 1999. ""Say My Name"" is also a song by French DJ David Guetta, American singer-songwriter Bebe Rexha and Colombian singer J Balvin. It was released as the eighth single from Guetta\'s album 7 on October 26, 2018. ""Say My Name"" is also a song performed by Swedish singer Tove Styrke from her third studio album, Sway (2018). It was released as the album\'s lead single on April 28, 2017. ""Say My Name"" is also a song by Australian electronic music duo Peking Duk. It is the first single from the group to be released in the United States and is taken from their first extended play, Songs to Sweat To, to be released on July 31 2015.\r\n- (QA_1) When did the song Say My Name by Destiny\'s Child come out? November 7, 1999.\r\n- (QA_2) When did the song Say My Name by Bebe Rexha and J Balvin come out? October 26, 2018.\r\n- (QA_3) When did the song Say My Name by Peking Duk come out? July 10, 2015.']",1.0,0.6955397582936257,0.25925925925925924
301,When did the movie the strangers come out?,"There is more than one movie titled ""The Strangers"". The first movie titled The Strangers is a horror film starring Liv Tyler and Scott Speedman. Originally slated for a theatrical release in November 2007, it was postponed before a theatrical release on May 30, 2008. A sequel, titled The Strangers: Prey at Night, was released on March 9, 2018. Another movie titled ""The Strangers"" was a Philippine horror adventure film. The film was released on December 25, 2012.","['- (Strangers (disambiguation)) There is more than one movie titled ""The Strangers"". The first movie titled The Strangers is a horror film starring Liv Tyler and Scott Speedman. Originally slated for a theatrical release in November 2007, it was postponed before a theatrical release on May 30, 2008. A sequel, titled The Strangers: Prey at Night, was released on March 9, 2018. Another movie titled ""The Strangers"" was a Philippine horror adventure film. The film was released on December 25, 2012.\r\n- (QA_1) When did the 2008 movie the strangers come out? May 30, 2008.\r\n- (QA_2) When did the 2012 movie the strangers come out? December 25, 2012.\r\n- (QA_3) When did the movie the strangers: Prey at Night come out? March 9, 2018.']",1.0,0.7536054542055118,0.16666666666666666
302,Who sings but i still haven't found what i'm looking for?,"Paul David Hewson, also known by his stage name “Bono” sings ""I Still Haven't Found What I'm Looking For"" with his Irish rock band, U2. ","['- (I Still Haven\'t Found What I\'m Looking For) Paul David Hewson, also known by his stage name “Bono” sings ""I Still Haven\'t Found What I\'m Looking For"" with his Irish rock band, U2.\r\n- (QA_1) Who is the band that sings but i still haven\'t found what i\'m looking for? U2.\r\n- (QA_2) Who is the singer that sings but i still haven\'t found what i\'m looking for? Paul David Hewson, Bono.']",1.0,0.8024645392854896,0.2
303,Record for cycling from lands end to john o'groats?,"The record for cycling from Land's End to John o' Groats is held by Andy Wilkinson, who completed the journey in 41 hours, 4 minutes and 22 seconds on a Windcheetah recumbent tricycle. ","[""- (Land's End to John o' Groats) The record for cycling from Land's End to John o' Groats is held by Andy Wilkinson, who completed the journey in 41 hours, 4 minutes and 22 seconds on a Windcheetah recumbent tricycle.\r\n- (QA_1) Who holds the record for cycling from lands end to john o'groats? Andy Wilkinson.\r\n- (QA_2) What is the record for cycling from lands end to john o'groats? 41 hours, 4 minutes and 22 seconds.""]",1.0,0.7924456894447433,0.2
304,Who sang it's the last song i'll ever write for you?,"""Last Song"" is 1972 hit song my Canadian trio Edward Bear. Larry Evoy formed Edward Bear in 1966 with Craig Hemming. With the addition of Danny Marks and Paul Weldon, the band played in the local Yorkville scene in Toronto and landed a recording deal with Capitol Records in 1969. ","['- (The Last Song I\'ll Write for You) ""Last Song"" is 1972 hit song my Canadian trio Edward Bear. Larry Evoy formed Edward Bear in 1966 with Craig Hemming. With the addition of Danny Marks and Paul Weldon, the band played in the local Yorkville scene in Toronto and landed a recording deal with Capitol Records in 1969.\r\n- (Last Song (Edward Bear song)) ""Last Song"" is 1972 hit song my Canadian trio Edward Bear. Larry Evoy formed Edward Bear in 1966 with Craig Hemming. With the addition of Danny Marks and Paul Weldon, the band played in the local Yorkville scene in Toronto and landed a recording deal with Capitol Records in 1969.\r\n- (QA_1) What trio sang the lyrics it\'s the last song i\'ll ever write for you, in their song titled Last song? Edward Bear.\r\n- (QA_2) Who is the singer that sang the lyrics it\'s the last song i\'ll ever write for you, in the song titled Last song? Lawrence Wayne ""Larry"" Evoy, Evoy, Larry Evoy.']",1.0,0.17323919098191168,0.4
305,Who constructed the suez canal and when was it finished?,"In 1858, Ferdinand de Lesseps formed the Suez Canal Company for the express purpose of building the canal. Construction of the canal lasted from 1859 to 1869 and took place under the regional authority of the Ottoman Empire. The canal officially opened on 17 November 1869.The ""New Suez Canal"", as the expansion was dubbed, was opened in a ceremony on 6 August 2015. On 24 February 2016, the Suez Canal Authority officially opened the new side channel. ","['- (Suez Canal) In 1858, Ferdinand de Lesseps formed the Suez Canal Company for the express purpose of building the canal. Construction of the canal lasted from 1859 to 1869 and took place under the regional authority of the Ottoman Empire. The canal officially opened on 17 November 1869. The ""New Suez Canal"", as the expansion was dubbed, was opened in a ceremony on 6 August 2015. On 24 February 2016, the Suez Canal Authority officially opened the new side channel.\r\n- (QA_1) Who is the company that constructed the suez canal? Universal Company of the Maritime Canal of Suez, Suez Canal Company.\r\n- (QA_2) When was the suez canal construction first finished? 17 November 1869.\r\n- (QA_3) Who launched construction the suez canal expansion? Egyptian government.']",1.0,0.7052237869958454,0.2727272727272727
306,When's the last time the new orleans saints won the superbowl?,"The New Orleans Saints won their first Super Bowl on February 7, 2010 against the Colts by a score of 31-17.","['- (QA_1) As of 2017, when was the last time the New Orleans Saints won the Super Bowl? February 7, 2010.\r\n- (QA_2) As of 2016, when was the last time the New Orleans Saints won the Super Bowl? February 7, 2010.\r\n- (QA_3) As of 2015, when was the last time the New Orleans Saints won the Super Bowl? February 7, 2010.']",0.3333333333333333,0.8246642695076029,0.16666666666666666
