sample_idx,question,answer,contexts,faithfulness,answer_relevancy,context_relevancy
0,When does the new bunk'd come out?,"The new bunk'd episode 41 comes out on April 21, 2017, episode 42 comes out on April 28, 2017 and episode 42 is due to come out on May 24, 2017. ","[""- (List of Bunk'd episodes) The new bunk'd episode 41 comes out on April 21, 2017, episode 42 comes out on April 28, 2017 and episode 42 is due to come out on May 24, 2017.\r\n- (QA_1) When does episode 42 of bunk'd come out? May 24, 2017.\r\n- (QA_2) When does episode 41 of bunk'd come out? April 28, 2017.\r\n- (QA_3) When does episode 40 of bunk'd come out? April 21, 2017.""]",0.6666666666666666,0.7262079308983759,0.14285714285714285
1,Who won the 2016 ncaa football national championship?,"The 2015 - 2016 season's ncaa national football championship game was played between the Clemson Tigers and the Alabama Crimson Tide on January 11, 2016. The Alabama Crimson Tide won the game by holding off the undefeated Clemson Tigers 45–40 in the fourth quarter.","[""- (2016 College Football Playoff National Championship) The 2015 - 2016 season's ncaa national football championship game was played between the Clemson Tigers and the Alabama Crimson Tide on January 11, 2016. The Alabama Crimson Tide won the game by holding off the undefeated Clemson Tigers 45–40 in the fourth quarter.\r\n- (QA_1) Who won the 2016 season's ncaa football national championship? Clemson Tigers, 2016 Clemson Tigers football team, 2016 Clemson Tigers football, the Tigers, Clemson, Clemson University.\r\n- (QA_2) Who won the ncaa football national championship played in 2016? 2015 Alabama Crimson Tide football team, Alabama Crimson Tide, Crimson Tide, Alabama, University of Alabama.""]",1.0,0.9489214633542589,0.16666666666666666
2,When was the last time the death penalty was used in pa?,"The last time the death penalty was used in pa was on July 6, 1999. ","['- (QA_1) As of 2017, when was the last time the death penalty was carried out in PA? July 6, 1999.\r\n- (QA_2) As of 2016, when was the last time the death penalty was carried out in PA? July 6, 1999.\r\n- (QA_3) As of 2015, when was the last time the death penalty was carried out in PA? July 6, 1999.']",1.0,0.9658357501220984,0.16666666666666666
3,Where will failure of the left ventricle cause increased pressure?,"""Backward"" failure of the left ventricle causes congestion of the lungs' blood vessels, and therefore causes increased pressure in the lungs. These symptoms are predominantly respiratory in nature.","['- (Heart failure) ""Backward"" failure of the left ventricle causes congestion of the lungs\' blood vessels, and therefore causes increased pressure in the lungs. These symptoms are predominantly respiratory in nature.\r\n- (QA_1) Where does failure of the left ventricle cause increased pressure? lungs.\r\n- (QA_2) Where does backwards failure of the left ventricle cause increased pressure? lung\'s blood vessels.']",1.0,0.6996296724678928,0.16666666666666666
4,Who won the war between ethiopia and italy?,The first war between Italy and Ethiopia took place from 1895 to 1896. This war was won by the Ethiopian army after the Battle of Adwa. The second war between the two nations was fought from October 1935 to February 1937 and was won by the Italians in the Battle of Maychew. ,['- (Second Italo-Ethiopian War) The first war between Italy and Ethiopia took place from 1895 to 1896. This war was won by the Ethiopian army after the Battle of Adwa. The second war between the two nations was fought from October 1935 to February 1937 and was won by the Italians in the Battle of Maychew.\r\n- (First Italo-Ethiopian War) The first war between Italy and Ethiopia took place from 1895 to 1896. This war was won by the Ethiopian army after the Battle of Adwa. The second war between the two nations was fought from October 1935 to February 1937 and was won by the Italians in the Battle of Maychew.\r\n- (QA_1) Who won the First Italo-Ethiopian War? Ethiopia.\r\n- (QA_2) Who won the Second Italo-Ethiopian War? Italy.'],1.0,0.7088954036564931,0.3
5,Who played bonnie in gone with the wind?,"The 1939 film gone with the wind's character Bonnie was portrayed by American child actress and public relations officer Eleanore Cammack ""Cammie"" King. A musical by the same name was officially opened at the New London Theatre on 22 April 2008. The character Bonnie was then played by Leilah de Meza.","['- (Gone with the Wind (musical)) The 1939 film gone with the wind\'s character Bonnie was portrayed by American child actress and public relations officer Eleanore Cammack ""Cammie"" King. A musical by the same name was officially opened at the New London Theatre on 22 April 2008. The character Bonnie was then played by Leilah de Meza.\r\n- (QA_1) Who played bonnie in the 1939 film gone with the wind? Eleanore Cammack ""Cammie"" King, Cammie King Conlon, King.\r\n- (QA_2) Who played bonnie in the 2008 musical gone with the wind? Leilah de Meza.']",1.0,0.9198703760563262,0.42857142857142855
6,Premier league record for most wins in a row?,"The English Premier league, a number of teams hold the record for most consecutive wins depending on whether you consider the start or end of the season. The record for most wins (9) in a row from the start of a season was achieved by Chelsea. If we're considering the most wins in a row to the end of a season, that record (14) goes to Manchester City. And if you don't consider the start or end of a season, that record (18) goes to both Manchester City and Liverpool.","[""- (Premier League records and statistics) The English Premier league, a number of teams hold the record for most consecutive wins depending on whether you consider the start or end of the season. The record for most wins (9) in a row from the start of a season was achieved by Chelsea. If we're considering the most wins in a row to the end of a season, that record (14) goes to Manchester City. And if you don't consider the start or end of a season, that record (18) goes to both Manchester City and Liverpool.\r\n- (QA_1) Premier league record for most wins in a row, not considering the start of end of a season? 18.\r\n- (QA_2) Premier league record for most wins in a row from the start of a season? 9.\r\n- (QA_3) Premier league record for most wins in a row to the end of a season? 14.""]",1.0,0.0,0.3
7,What episode does goku become super saiyan 3?,"In the Dragon Ball Z Kai anime series, goku becomes super saiyan 3 in the English title translation Delay Majin Buu, The Limit! Super Saiyan 3!!, Dub title Hold Majin Buu in Check! Limit — Super Saiyan 3!, episode 133 or Majin Bū o Kuitomero, Rimitto! Sūpā Saiya-jin Surī!! in Japanese. ","['- (List of Dragon Ball Z Kai episodes) In the Dragon Ball Z Kai anime series, goku becomes super saiyan 3 in the English title translation Delay Majin Buu, The Limit! Super Saiyan 3!!, Dub title Hold Majin Buu in Check! Limit — Super Saiyan 3!, episode 133 or Majin Bū o Kuitomero, Rimitto! Sūpā Saiya-jin Surī!! in Japanese.\r\n- (QA_1) What episode number does goku become super saiyan 3? 133.\r\n- (QA_2) What is the translated English title of the episode where goku become super saiyan 3? ""Delay Majin Buu, The Limit! Super Saiyan 3!!"".\r\n- (QA_3) What is the Dub title of the episode where goku become super saiyan 3? ""Hold Majin Buu in Check! Limit — Super Saiyan 3!"".']",0.0,0.8842403696832827,0.5833333333333334
8,Who published harry potter and the prisoner of azkaban?,"The third book in the ""Harry Potter"" series Harry Potter and the Prisoner of Azkaban was published in the UK, US and Canada. It was published by Bloomsbury in the UK, by Scholastic, Inc. in the US and by Raincoast in Canada. ","['- (Harry Potter and the Prisoner of Azkaban) The third book in the ""Harry Potter"" series Harry Potter and the Prisoner of Azkaban was published in the UK, US and Canada. It was published by Bloomsbury in the UK, by Scholastic, Inc. in the US and by Raincoast in Canada.\r\n- (QA_1) Who published harry potter and the prisoner of azkaban in the UK? Bloomsbury.\r\n- (QA_2) Who published harry potter and the prisoner of azkaban in the US? Scholastic, Inc..\r\n- (QA_3) Who published harry potter and the prisoner of azkaban in Canada? Raincoast.']",1.0,0.8517332205038531,0.125
9,When does doctor strange get the infinity stone?,"In the animated direct-to-video film, Doctor Strange: The Sorcerer Supreme, Doctor Strange first gets the Eye of Agamotto, one of the fictional universe's Infinity Stones. In Secret Wars, Doctor strange gets the infinity stone after various alternate universes are combined into Battleworld. In the Marvel Cinematic Universe films between 2016 to 2019, ""Doctor Strange"" gets the infinity stone in the 2016 film. ","['- (Infinity Gems) In the animated direct-to-video film, Doctor Strange: The Sorcerer Supreme, Doctor Strange first gets the Eye of Agamotto, one of the fictional universe\'s Infinity Stones. In Secret Wars, Doctor strange gets the infinity stone after various alternate universes are combined into Battleworld. In the Marvel Cinematic Universe films between 2016 to 2019, ""Doctor Strange"" gets the infinity stone in the 2016 film.\r\n- (Eye of Agamotto) In the animated direct-to-video film, Doctor Strange: The Sorcerer Supreme, Doctor Strange first gets the Eye of Agamotto, one of the fictional universe\'s Infinity Stones. In Secret Wars, Doctor strange gets the infinity stone after various alternate universes are combined into Battleworld. In the Marvel Cinematic Universe films between 2016 to 2019, ""Doctor Strange"" gets the infinity stone in the 2016 film.\r\n- (Doctor Strange) In the animated direct-to-video film, Doctor Strange: The Sorcerer Supreme, Doctor Strange first gets the Eye of Agamotto, one of the fictional universe\'s Infinity Stones. In Secret Wars, Doctor strange gets the infinity stone after various alternate universes are combined into Battleworld. In the Marvel Cinematic Universe films between 2016 to 2019, ""Doctor Strange"" gets the infinity stone in the 2016 film.\r\n- (QA_1) When does doctor strange get the infinity stone in Secret Wars? After various alternate universes are combined into Battleworld,.\r\n- (QA_2) In what Marvel Cinematic Universe film does doctor strange get the infinity stone? Doctor Strange (2016), Doctor Strange.\r\n- (QA_3) In what animated film does doctor strange first get the infinity stone? Doctor Strange: The Sorcerer Supreme.']",1.0,0.6030259008262262,0.13333333333333333
10,How many episodes does the dragonball z series have?,"Here is a breakdown of the number of episodes in the anime series Dragon Ball Z. Dragon Ball Z has a total of 291 episodes. There are 276 episodes in the original dub. Dragon Ball Z Kai: The Final Chapters contains 69 episodes, Dragon Ball Z Kai not including The Final Chapters consists of 159 and a total 167 episodes of Dragon Ball Z Kai.","['- (List of Dragon Ball Z episodes) Here is a breakdown of the number of episodes in the anime series Dragon Ball Z. Dragon Ball Z has a total of 291 episodes. There are 276 episodes in the original dub. Dragon Ball Z Kai: The Final Chapters contains 69 episodes, Dragon Ball Z Kai not including The Final Chapters consists of 159 and a total 167 episodes of Dragon Ball Z Kai.\r\n- (QA_1) How many total episodes of Dragon Ball Z are there? 291.\r\n- (QA_2) How many total episodes of Dragon Ball Z are there in the original dub? 276.\r\n- (QA_3) How many total episodes of Dragon Ball Z Kai: The Final Chapters are there? 69.']",1.0,0.8896830039494675,0.1111111111111111
11,Who sang climb every mountain in the sound of music movie?,"In her final screen appearance, actress Peggy Wood played the Mother Abbess in the 1965 movie The Sound of Music. ","['- (QA_1) Which character sang climb every mountain in the sound of music movie? Mother Abbess.\r\n- (QA_2) Which actress sang climb every mountain in the sound of music movie? Wood, Mary Margaret Wood, Peggy Wood.']",0.5,0.16596249594114046,1.0
12,Who is the attorney general for new jersey?,"Between 2013 and 2018, there have been three attorney general for new jersey. From 2013-2016, this position was held by John Jay Hoffman. On February 29, 2016, Robert Lougy was appointed by Governor Chris Christie to serve as the state's Attorney General following the resignation of John Jay Hoffman. Lougy resigned from this position on March 14, 2016. Then from 2016 to 2018, this position was held by American trial lawyer Christopher S. Porrino. ","['- (QA_1) Who is the attorney general for new jersey from 2016-2018? Christopher S. Porrino, Christopher Porrino.\r\n- (QA_2) Who is the acting attorney general for new jersey in 2016? Robert Lougy.\r\n- (QA_3) Who is the acting attorney general for new jersey in 2013-2016? John Jay Hoffman, John Hoffman.']",0.5,0.8563650829172786,0.3333333333333333
13,Who does angelina jolie play in kung fu panda?,"In the kung fu panda franchise consisting of Kung Fu Panda (Secrets of the Furious Five), Kung Fu Panda 2 (Secrets of the Masters) and Kung Fu Panda 3 (2016) actress Angelina Jolie plays Master Tigress in all three movies. The Kung Fu Panda Holiday Special, a spinoff of the Kung Fu Panda franchise also features Angelina Jolie as Master Tigress. ",['- (QA_1) What role does Angelina Jolie play in Kung Fu Panda? Master Tigress.\r\n- (QA_2) Who does Angelina Jolie play in Kung Fu Panda 2? Master Tigress.\r\n- (QA_3) Who does Angelina Jolie play in Kung Fu Panda 3? Master Tigress.'],0.25,0.9242267715217062,0.5
14,What was the period before the enlightenment called?,"Although the chronological limits of this period are open to debate, the period of Enlightenment in Europe is said to have lasted between the 17th and 18th centuries. The period of time before that is described as the middle ages. The Petrine Era (Russia, 1689–1725) would fall under this time period. ","['- (List of time periods) Although the chronological limits of this period are open to debate, the period of Enlightenment in Europe is said to have lasted between the 17th and 18th centuries. The period of time before that is described as the middle ages. The Petrine Era (Russia, 1689–1725) would fall under this time period.\r\n- (QA_1) Within the early modern period, what was before the enlightenment? Petrine Era.\r\n- (QA_2) What period came before the period containing the enlightenment? Middle Ages.']",1.0,0.0,0.14285714285714285
15,Who came up with the saying the customer is always right?,"""The customer is always right"" is a motto or slogan which exhorts service staff to give a high priority to customer satisfaction. It was popularised by pioneering and successful retailers such as Harry Gordon Selfridge who founded the London-based department store Selfridges, Philadelphia native John Wanamaker and Marshall Field and Company founder Marshall Field. ","['- (The customer is always right) ""The customer is always right"" is a motto or slogan which exhorts service staff to give a high priority to customer satisfaction. It was popularised by pioneering and successful retailers such as Harry Gordon Selfridge who founded the London-based department store Selfridges, Philadelphia native John Wanamaker and Marshall Field and Company founder Marshall Field.\r\n- (QA_1) Who from London came up with the saying the customer is always right? Harry Gordon Selfridge, Harry Gordon Selfridge, Sr..\r\n- (QA_2) Who from Philadelphia came up with the saying the customer is always right? John Wanamaker.\r\n- (QA_3) Who from New York City came up with the saying the customer is always right? Marshall Field.']",1.0,0.7160895404610762,0.5
16,Who came up with the social learning theory?,"The theory of learning process and social behavior,  Social learning theory was originated by Canadian-American psychologist Albert Bandura. It's basis however comes from American psychologist B.F. Skinner's 1940's lectures series on verbal behavior and proposed use of stimulus-response theories to describe language use and development. In 1941, a book on ""Social Learning Theory"" was published by American experimental psychologist Neil Miller and psychologist John Dollard to come up with a reinterpretation of psychoanalytic theory in terms of stimulus-response. ","['- (Social learning theory) The theory of learning process and social behavior,  Social learning theory was originated by Canadian-American psychologist Albert Bandura. It\'s basis however comes from American psychologist B. F. Skinner\'s 1940\'s lectures series on verbal behavior and proposed use of stimulus-response theories to describe language use and development. In 1941, a book on ""Social Learning Theory"" was published by American experimental psychologist Neil Miller and psychologist John Dollard to come up with a reinterpretation of psychoanalytic theory in terms of stimulus-response.\r\n- (QA_1) Who came up with and published a book in 1941 about the social learning theory? Neil Miller and John Dollard, Neil Miller, John Dollard.\r\n- (QA_2) Who came up with ideas the formed the basis for the social learning theory? B.F. Skinner, Skinner.\r\n- (QA_3) Who came up with the social learning theory and is credited as its originator? Albert Bandura.']",1.0,0.9483506054007766,0.1111111111111111
17,Apartheid ended in south africa during the presidency of?,The apartheid system in South Africa ended in 1994 after Democratically elected President Nelson Mandela took office from his predecessor Frederik Willem de Klerk. F. W. de Klerk  continued to serve as a Deputy President in Mandela's ANC-led coalition until 1996. This time period also closely coincides with the beginning of U.S President Bill Clinton's time in office (1993 - 2001). ,['- (QA_1) Apartheid ended in South Africa at the end of whose South African presidency? F. W. de Klerk.\r\n- (QA_2) Apartheid ended in South Africa at the beginning of whose South African presidency? Nelson Mandela.\r\n- (QA_3) Apartheid ended in South Africa during whose American presidency? Bill Clinton.'],0.7142857142857143,0.7245724396518326,0.6666666666666666
18,What is the name of the pirate in spongebob?,"In the American animated comedy television series SpongeBob SquarePants, the live-action pirate is known as Patchy the Pirate. His role is to serve as the president of the fictional ""SpongeBob"" fan club and host the series' special episodes. The 2015 film adaptation (spongebob 2) of the tv series, introduces a different pirate by the name of Burger Beard who steals the secret Krabby Patty formula for which SpongeBob and his friends must travel to the ocean's surface to confront him and retrieve the formula. ","['- (The SpongeBob Movie: Sponge Out of Water) In the American animated comedy television series SpongeBob SquarePants, the live-action pirate is known as Patchy the Pirate. His role is to serve as the president of the fictional ""SpongeBob"" fan club and host the series\' special episodes. The 2015 film adaptation (spongebob 2) of the tv series, introduces a different pirate by the name of Burger Beard who steals the secret Krabby Patty formula for which SpongeBob and his friends must travel to the ocean\'s surface to confront him and retrieve the formula.\r\n- (QA_1) What is the name of the live-action pirate in spongebob? Patchy.\r\n- (QA_2) What is the name of the pirate in the spongebob2 movie? Burger Beard.']",1.0,0.827367901573994,0.2857142857142857
19,Who plays santa claus in rise of the guardians?,"In the 2012 American 3D computer-animated action fantasy film Rise of the Guardians, Santa Clause is played by American actor Alec Baldwin. In the video game film version (also released in November 2012), Santa Clause is portrayed by American voice actor Fred Tatasciore. ","['- (Rise of the Guardians: The Video Game) In the 2012 American 3D computer-animated action fantasy film Rise of the Guardians, Santa Clause is played by American actor Alec Baldwin. In the video game film version (also released in November 2012), Santa Clause is portrayed by American voice actor Fred Tatasciore.\r\n- (Rise of the Guardians) In the 2012 American 3D computer-animated action fantasy film Rise of the Guardians, Santa Clause is played by American actor Alec Baldwin. In the video game film version (also released in November 2012), Santa Clause is portrayed by American voice actor Fred Tatasciore.\r\n- (QA_1) Who plays Santa Clause in the movie Rise of the Guardians? Alec Baldwin.\r\n- (QA_2) Who plays Santa Clause in Rise of the Guardians: The Video Game? Fred Tatasciore.']",0.75,0.9171547494606241,0.25
20,India's first official entry at the oscars?,"The 1957 Hindi film ""Mother India"" was India's first film submission to the Academy Awards, popularly known as the Oscars. ","[""- (QA_1) What was the year of India's first official entry at the oscars? 1957.\r\n- (QA_2) What film was India's first official entry at the oscars? Mother India.""]",0.5,0.7217559996929115,1.0
21,When did i can only imagine get released?,"There are a number of songs by the name ""i can only imagine"". The Christian rock band MercyMe released a hit song of the same name on October 12, 2001 which went on to become the most-played Christian single of 2002. Years later, on March 16, 2018, a film based on the story behind this song was released in the United States. A different song by the same title was released on April 23, 2012 by French DJ David Guetta, featuring vocals from American singer Chris Brown and rapper Lil Wayne. This same song was released on May 2, 2012 in Australia, Austria, Belgium, Finland, Germany, Italy, Japan, the Netherlands, New Zealand, Norway, and Switzerland. ","['- (QA_1) When did the 2001 song i can only imagine get released? October 12, 2001.\r\n- (QA_2) When did the 2012 song i can only imagine get released in the United States? 2 May 2012.\r\n- (QA_3) When did the film i can only imagine get released? March 16, 2018.']",0.2857142857142857,0.5696301590295691,0.5
22,Where is the u21 euro championships being held?,"The biennial football competition, UEFA European Under-21 Championship has been held in Czech Republic (2015), Poland (2017) and in Italy (2019).","['- (UEFA European Under-21 Championship) The biennial football competition, UEFA European Under-21 Championship has been held in Czech Republic (2015), Poland (2017) and in Italy (2019).\r\n- (QA_1) Where is the UEFA European U-21 Championship being held in 2019? Italy.\r\n- (QA_2) Where was the UEFA European U-21 Championship held in 2017? Poland.\r\n- (QA_3) Where was the UEFA European U-21 Championship held in 2015? Czech Republic.']",1.0,0.7304299795835055,0.0
23,When was television introduced to the general public?,"On March 25, 1925, Scottish inventor and innovator John Baird gave the first public demonstration of televised silhouette images in motion. A few months later, on June 13, 1925, American inventor Charles Francis Jenkins publicly demonstrated the synchronized transmission of silhouette pictures. As television technology advanced, more innovations were added to the television system. As such, Manfred von Ardenne gave a public demonstration in August 1931 of a television system using a cathode-ray tube (CRT) for both transmission and reception. On August 25, 1934, Philo Farnsworth gave the world's first public demonstration of an all-electronic television system, using a live camera. This would also coincide with the date when all-electric television were introduced to the general public.","[""- (History of television) On March 25, 1925, Scottish inventor and innovator John Baird gave the first public demonstration of televised silhouette images in motion. A few months later, on June 13, 1925, American inventor Charles Francis Jenkins publicly demonstrated the synchronized transmission of silhouette pictures. As television technology advanced, more innovations were added to the television system. As such, Manfred von Ardenne gave a public demonstration in August 1931 of a television system using a cathode-ray tube (CRT) for both transmission and reception. On August 25, 1934, Philo Farnsworth gave the world's first public demonstration of an all-electronic television system, using a live camera. This would also coincide with the date when all-electric television were introduced to the general public.\r\n- (QA_1) When was televised silhouette images in motion introduced to the general public? March 25, 1925.\r\n- (QA_2) When was synchronized transmission of silhouette pictures introduced to the general public? June 13, 1925.\r\n- (QA_3) When was CRT television introduced to the general public? August 1931.""]",1.0,0.6030019962528849,0.16666666666666666
24,Who was the mom in how i met your mother?,"In the CBS television sitcom ""How I Met Your Mother"", the title character ""The Mother"" who's otherwise known as Tracy McConnell on the show is portrayed by American actress Cristin Milioti. The show, narrated by Future Ted (Bob Saget), tells the story of how Ted Mosby (Josh Radnor) met his children's mother.","['- (The Mother (How I Met Your Mother)) In the CBS television sitcom ""How I Met Your Mother"", the title character ""The Mother"" who\'s otherwise known as Tracy McConnell on the show is portrayed by American actress Cristin Milioti. The show, narrated by Future Ted (Bob Saget), tells the story of how Ted Mosby (Josh Radnor) met his children\'s mother.\r\n- (QA_1) Who was The Mother in How I Met Your Mother? Tracy Mosby, Tracy McConnell.\r\n- (QA_2) Who was the actor who plays the mom in How I Met Your Mother? Cristin Milioti.']",1.0,0.8922650804928779,0.3333333333333333
