sample_idx,question,answer,contexts,faithfulness,answer_relevancy,context_relevancy
134,The first unix operating system was written in which language?,"Unix is a family of multitasking, multiuser computer operating systems whose development started in the 1970s at the Bell Labs research center by Ken Thompson, Dennis Ritchie, and others. The operating system was originally written in assembly language, but in 1973, Version 4 Unix was rewritten in the higher-level language C, contrary to the general notion at the time that an operating system's complexity and sophistication required it to be written in assembly language.","[""- (Unix) Unix is a family of multitasking, multiuser computer operating systems whose development started in the 1970s at the Bell Labs research center by Ken Thompson, Dennis Ritchie, and others. The operating system was originally written in assembly language, but in 1973, Version 4 Unix was rewritten in the higher-level language C, contrary to the general notion at the time that an operating system's complexity and sophistication required it to be written in assembly language.\r\n- (QA_1) The first unix operating system was originally written in which language? Assembly.\r\n- (QA_2) The first unix operating system was rewritten in which language? C.""]",1.0,0.9115850601143731,0.5
135,Where do they make ben and jerry's ice cream?,"Ben & Jerry's is a Vermont, United States-based company that manufactures ice cream, frozen yogurt, and sorbet. The company produces its ice cream in several locations around the world, with its main factory being in Waterbury, Vermont, and a secondary factory in Saint Albans, Vermont. It also has an ice cream factory in Henderson, Nevada. Outside of the United States there is a factory in Hellendoorn, Netherlands, and Be'er Tuvia, Israel where their ice cream is made.","[""- (Ben & Jerry's) Ben & Jerry's is a Vermont, United States-based company that manufactures ice cream, frozen yogurt, and sorbet. The company produces its ice cream in several locations around the world, with its main factory being in Waterbury, Vermont, and a secondary factory in Saint Albans, Vermont. It also has an ice cream factory in Henderson, Nevada. Outside of the United States there is a factory in Hellendoorn, Netherlands, and Be'er Tuvia, Israel where their ice cream is made.\r\n- (QA_1) Where is the main factory where they make Ben and Jerry's ice cream? Waterbury, Vermont.\r\n- (QA_2) Where is the secondary factory in Vermont where they make Ben and Jerry's ice cream? Saint Albans, Saint Albans, Vermont.\r\n- (QA_3) Where is the secondary factory in Nevada where they made Ben and Jerry's ice cream? Henderson, Nevada.""]",1.0,0.8473817036179486,0.4
136,Who is the author of wings of fire?,"Wings of Fire: An Autobiography of APJ Abdul Kalam is an autobiography on the former President of India, and was written by Dr. Abdul Kalam and Arun Tiwari. There is also an unrelated series of fantasy novels written by author Tui T. Sutherland called Wings of Fire, which focuses on young dragons fulfilling prophecies in a fantasy world. Also unrelated is the 1967 American made-for-television action-drama film Wings of Fire (aka The Cloudburst) which was written by Stirling Dale Silliphant, and concerns a female pilot wanting to become an air racer.","['- (Wings of Fire (film)) Wings of Fire: An Autobiography of APJ Abdul Kalam is an autobiography on the former President of India, and was written by Dr. Abdul Kalam and Arun Tiwari. There is also an unrelated series of fantasy novels written by author Tui T. Sutherland called Wings of Fire, which focuses on young dragons fulfilling prophecies in a fantasy world. Also unrelated is the 1967 American made-for-television action-drama film Wings of Fire (aka The Cloudburst) which was written by Stirling Dale Silliphant, and concerns a female pilot wanting to become an air racer.\r\n- (Wings of Fire (novel series)) Wings of Fire: An Autobiography of APJ Abdul Kalam is an autobiography on the former President of India, and was written by Dr. Abdul Kalam and Arun Tiwari. There is also an unrelated series of fantasy novels written by author Tui T. Sutherland called Wings of Fire, which focuses on young dragons fulfilling prophecies in a fantasy world. Also unrelated is the 1967 American made-for-television action-drama film Wings of Fire (aka The Cloudburst) which was written by Stirling Dale Silliphant, and concerns a female pilot wanting to become an air racer.\r\n- (QA_1) Who is the author of the autobiography wings of fire? Arun Tiwari, A. P. J. Abdul Kalam.\r\n- (QA_2) Who is the author of the novel series wings of fire? Tui T. Sutherland.\r\n- (QA_3) Who is the author of the film wings of fire? Stirling Dale Silliphant, Stirling Silliphant.']",1.0,0.5182370976426354,0.08333333333333333
137,Very geologically active region with many earthquakes and volcanoes?,"On Earth, the Cascade volcanoes define the Pacific Northwest section of the Ring of Fire, an array of volcanoes that rim the Pacific Ocean. The Ring of Fire is also known for its frequent earthquakes. The volcanoes and earthquakes arise from a geological process called subduction. On a grander scale, the tidal heating produced by forced orbital eccentricity on Jupiter's innermost moon, Io, has made it the most volcanically active world in the Solar System, with hundreds of volcanic centres and extensive lava flows.","['- (QA_1) Very geologically active region near Jupiter with many earthquakes and volcanoes? Io, Jupiter I.\r\n- (QA_2) Very geologically active region on the Earth with many earthquakes and volcanoes? The Ring of Fire, Rim of Fire, the Rim of Fire, the Circum-Pacific belt, Ring of Fire, Circum-Pacific belt.']",1.0,0.5529986691909258,1.0
138,What are the dads names in mama mia?,"Mamma Mia! is the title of both a jukebox musical and romantic comedy film, both written by British playwright Catherine Johnson. The film has multiple characters playing as a dad. They are Irish-American architect Sam Carmichael, Swedish adventurer and writer Bill Anderson, and British banker Harry Bright. However, the character playing as the adventurer and writer is named Bill Austin in the musical version. ","['- (Mamma Mia! (film)) Mamma Mia! is the title of both a jukebox musical and romantic comedy film, both written by British playwright Catherine Johnson. The film has multiple characters playing as a dad. They are Irish-American architect Sam Carmichael, Swedish adventurer and writer Bill Anderson, and British banker Harry Bright. However, the character playing as the adventurer and writer is named Bill Austin in the musical version.\r\n- (QA_1) What is the Irish-American dads names in mama mia? Sam Carmichael.\r\n- (QA_2) What is the Swedish dads names in the mama mia film? Bill Anderson.\r\n- (QA_3) What is the British dads names in mama mia? Harry Bright.']",1.0,0.8594978126067069,0.18181818181818182
139,Where did the song santa claus is coming to town come from?,"""Santa Claus Is Comin' to Town"" is a Christmas song, written by J. Fred Coots and Haven Gillespie and was first sung on Eddie Cantor's radio show in November 1934. It became an instant hit with orders for 500,000 copies of sheet music and more than 30,000 records sold within 24 hours.","['- (Santa Claus Is Comin\' to Town) ""Santa Claus Is Comin\' to Town"" is a Christmas song, written by J. Fred Coots and Haven Gillespie and was first sung on Eddie Cantor\'s radio show in November 1934. It became an instant hit with orders for 500,000 copies of sheet music and more than 30,000 records sold within 24 hours.\r\n- (QA_1) Which show was the song santa claus is coming to town sung?   Eddie Cantor\'s radio show.\r\n- (QA_2) Who wrote the song santa claus is coming to town?   J. Fred Coots and Haven Gillespie.']",1.0,0.4576541520077721,0.16666666666666666
140,When is the next mayoral election in nyc?,"The mayor of New York City, officially Mayor of the City of New York, is head of the executive branch of the Government of New York City. The 2009 election for Mayor of New York City took place on Tuesday, November 3, with incumbent winner Michael Bloomberg taking office. The 2013 New York City mayoral election occurred on November 5, after which Bill De Blasio became the first Democrat to win a mayoral election in the city since 1989. Another election for Mayor of New York City was held on November 7, 2017, where de Blasio won reelection to a second term.","['- (2013 New York City mayoral election) The mayor of New York City, officially Mayor of the City of New York, is head of the executive branch of the Government of New York City. The 2009 election for Mayor of New York City took place on Tuesday, November 3, with incumbent winner Michael Bloomberg taking office. The 2013 New York City mayoral election occurred on November 5, after which Bill De Blasio became the first Democrat to win a mayoral election in the city since 1989. Another election for Mayor of New York City was held on November 7, 2017, where de Blasio won reelection to a second term.\r\n- (2009 New York City mayoral election) The mayor of New York City, officially Mayor of the City of New York, is head of the executive branch of the Government of New York City. The 2009 election for Mayor of New York City took place on Tuesday, November 3, with incumbent winner Michael Bloomberg taking office. The 2013 New York City mayoral election occurred on November 5, after which Bill De Blasio became the first Democrat to win a mayoral election in the city since 1989. Another election for Mayor of New York City was held on November 7, 2017, where de Blasio won reelection to a second term.\r\n- (QA_1) When is the next mayoral election in nyc in 2017? November 7, 2017.\r\n- (QA_2) When is the next mayoral election in nyc in 2013? November 5, 2013.\r\n- (QA_3) When is the next mayoral election in nyc in 2009? November 3, 2009.']",1.0,0.6374928382662616,0.07142857142857142
141,When did the ipad 1st gen come out?,"The first-generation iPad is a tablet computer designed and marketed by Apple Inc. as the first device in the iPad lineup of tablet computers. It had multiple versions released between April and September of 2010. On April 3, 2010, the Wi-Fi variant was released in the United States, and on April 30 they released the same version with cellular. On May 28, 2010, it was released in Spain, Italy, Switzerland, UK, Germany, Australia, Japan, Canada, and France. On July 23, 2010, it was released in Austria, Belgium, Hong Kong, Ireland, Luxembourg, Mexico, Netherlands, New Zealand, and Singapore. Finally, on September 17, 2010, it was made available to people in China.","['- (QA_1) When did the ipad 1st gen come out in United States as Wi-Fi variant? April 3, 2010.\r\n- (QA_2) When did the ipad 1st gen come out in United States as ""Wi-Fi + Cellular"" variant? April 30,2010.\r\n- (QA_3) When did the ipad 1st gen come out in Spain,Italy,Switzerland,United Kingdom,Germany,Australia,Japan,Canada,France? May 28, 2010.']",0.52,0.6873751365922077,0.5
142,What is the ranking of india in asian games 2018?,"The 2018 Asian Games, officially known as the 18th Asian Games and also known as Jakarta–Palembang 2018, was a continental multi-sport event that was held from 18 August to 2 September 2018 in Jakarta and Palembang. Multiple rankings were given out during the games. India ranked 8th in number of athletes, as well as 8th in number of gold medals. They also ranked 6th in total number of medals in the games.  ","['- (2018 Asian Games) The 2018 Asian Games, officially known as the 18th Asian Games and also known as Jakarta–Palembang 2018, was a continental multi-sport event that was held from 18 August to 2 September 2018 in Jakarta and Palembang. Multiple rankings were given out during the games. India ranked 8th in number of athletes, as well as 8th in number of gold medals. They also ranked 6th in total number of medals in the games.\r\n- (QA_1) What is the ranking of India in number of athletes in the Asian games 2018? 8th.\r\n- (QA_2) What is the ranking of India in total number of medals in the 2018 Asian games? 6th.\r\n- (QA_3) What is the ranking of India in number of gold medals in the 2018 Asian games? 8th.']",1.0,0.9185991538142643,0.2
143,How much of the worlds energy is produced by nuclear power?,"World energy supply and consumption is global production and preparation of fuel, generation of electricity, energy transport and energy consumption. The percentage of the world's energy produced by nuclear power has varied year after year. In 2014, global nuclear power usage was at 11%. In 2016, the percentage was 5%. The year after, in 2017, the percentage dropped slightly to 4.9%.",['- (QA_1) What percentage of the worlds energy is produced by nuclear power in 2017? 4.9%.\r\n- (QA_2) What percentage of the worlds energy is produced by nuclear power in 2014? 11%.\r\n- (QA_3) What percentage of the worlds energy is produced by nuclear power in 2016? 5%.'],0.5,0.8396155380575743,1.0
144,Who sings only know your lover when you let her go lyrics?,"""Let Her Go"" is a song written and recorded by English singer-songwriter Passenger, and has been performed by multiple artists. Taylor Henderson covered the song in his debut self-titled album released through Sony Music Australia on 29 November 2013. In December 2013, Violetta Zironi also recorded and released the song in her debut EP ""Dimmi che non passa"". It was also covered by Dutch symphonic metal band Within Temptation on the album ""Hydra"" in 2014 and The Q-Music Sessions, as well as by Jasmine Thompson on the album ""Bundle of Tantrums"". Finally, in January 2015, British indie band ""Scars on 45"" covered the song on the album ""From Cover to Cover: 30 Years at Nettwerk"".","['- (Let Her Go) ""Let Her Go"" is a song written and recorded by English singer-songwriter Passenger, and has been performed by multiple artists. Taylor Henderson covered the song in his debut self-titled album released through Sony Music Australia on 29 November 2013. In December 2013, Violetta Zironi also recorded and released the song in her debut EP ""Dimmi che non passa"". It was also covered by Dutch symphonic metal band Within Temptation on the album ""Hydra"" in 2014 and The Q-Music Sessions, as well as by Jasmine Thompson on the album ""Bundle of Tantrums"". Finally, in January 2015, British indie band ""Scars on 45"" covered the song on the album ""From Cover to Cover: 30 Years at Nettwerk"".\r\n- (QA_1) Who sang the original version of Let Her Go? Passenger.\r\n- (QA_2) Who sang the version of Let Her Go that was released through Sony Music Australia? Taylor Henderson.\r\n- (QA_3) Who sang the version of Let Her Go that was released in December 2013? Violetta Zironi.']",1.0,0.5165834315011313,0.09090909090909091
145,Who founded the royal academy of painting and sculpture in france?,"The Académie Royale de Peinture et de Sculpture (Royal Academy of Painting and Sculpture) was the premier art institution of France during the latter part of the Ancien Régime until it was abolished in 1793 during the French Revolution. It was founded at the Palais-Royal in 1648, when Martin de Charmois presented the petition to the nine-year-old King Louis XIV, and his mother Anne of Austria who acted as regent and the whole Royal Council. All present approved and the foundation of the Académie Royale was granted.","['- (Académie royale de peinture et de sculpture) The Académie Royale de Peinture et de Sculpture (Royal Academy of Painting and Sculpture) was the premier art institution of France during the latter part of the Ancien Régime until it was abolished in 1793 during the French Revolution. It was founded at the Palais-Royal in 1648, when Martin de Charmois presented the petition to the nine-year-old King Louis XIV, and his mother Anne of Austria who acted as regent and the whole Royal Council. All present approved and the foundation of the Académie Royale was granted.\r\n- (QA_1) Who founded the royal academy of painting and sculpture in france by approving a petition? Louis XIV, the whole Royal Council, Anne of Austria.\r\n- (QA_2) Who founded the royal academy of painting and sculpture in france by making a petition for it? Pierre Séguier, several more artists, Martin de Charmois.']",1.0,0.7520862642501446,0.2857142857142857
146,Piper's real name orange is the new black?,"Piper Eressea Kerman is an American author who was indicted in 1998, on charges of felonious money-laundering activities, and sentenced to 15 months' detention in a federal correctional facility. Her memoir of her prison experiences, Orange Is the New Black: My Year in a Women's Prison, was adapted into the critically acclaimed Netflix original comedy-drama series ""Orange Is the New Black"". Taylor Jane Schilling is an American actress, known for playing the role of Piper Eressea Kerman as Piper Chapman on the show.","['- (Piper Kerman) Piper Eressea Kerman is an American author who was indicted in 1998, on charges of felonious money-laundering activities, and sentenced to 15 months\' detention in a federal correctional facility. Her memoir of her prison experiences, Orange Is the New Black: My Year in a Women\'s Prison, was adapted into the critically acclaimed Netflix original comedy-drama series ""Orange Is the New Black"". Taylor Jane Schilling is an American actress, known for playing the role of Piper Eressea Kerman as Piper Chapman on the show.\r\n- (QA_1) What is Piper\'s character\'s real name in Orange is the New Black? Piper Eressea Kerman.\r\n- (QA_2) What is the name of the actress who plays Piper on Orange is the New Black? Taylor Jane Schilling.']",1.0,0.6159060884248041,0.2857142857142857
147,When does the regular football season start for nfl?,"The National Football League regular season begins on the weekend following the first Monday of September (i.e, the weekend following the Labor Day holiday) and ends in December or early January. Because of this, the actual start date for the regular season will vary from year to year. The 2015 NFL season was the 96th season and began on September 10, 2015. The 2016 NFL season was the 97th season and began on September 8, 2016. In 2017, the NFL held its 98th season, which began on September 7, 2017.","['- (2017 NFL season) The National Football League regular season begins on the weekend following the first Monday of September (i. e, the weekend following the Labor Day holiday) and ends in December or early January. Because of this, the actual start date for the regular season will vary from year to year. The 2015 NFL season was the 96th season and began on September 10, 2015. The 2016 NFL season was the 97th season and began on September 8, 2016. In 2017, the NFL held its 98th season, which began on September 7, 2017.\r\n- (2015 NFL season) The National Football League regular season begins on the weekend following the first Monday of September (i. e, the weekend following the Labor Day holiday) and ends in December or early January. Because of this, the actual start date for the regular season will vary from year to year. The 2015 NFL season was the 96th season and began on September 10, 2015. The 2016 NFL season was the 97th season and began on September 8, 2016. In 2017, the NFL held its 98th season, which began on September 7, 2017.\r\n- (2016 NFL season) The National Football League regular season begins on the weekend following the first Monday of September (i. e, the weekend following the Labor Day holiday) and ends in December or early January. Because of this, the actual start date for the regular season will vary from year to year. The 2015 NFL season was the 96th season and began on September 10, 2015. The 2016 NFL season was the 97th season and began on September 8, 2016. In 2017, the NFL held its 98th season, which began on September 7, 2017.\r\n- (NFL regular season) The National Football League regular season begins on the weekend following the first Monday of September (i. e, the weekend following the Labor Day holiday) and ends in December or early January. Because of this, the actual start date for the regular season will vary from year to year. The 2015 NFL season was the 96th season and began on September 10, 2015. The 2016 NFL season was the 97th season and began on September 8, 2016. In 2017, the NFL held its 98th season, which began on September 7, 2017.\r\n- (QA_1) In general, when does the regular football season start for nfl? the weekend following the Labor Day, the weekend following the first Monday of September.\r\n- (QA_2) When does the regular football season start for nfl in 2017? September 7, 2017.\r\n- (QA_3) When does the regular football season start for nfl in 2016? September 8, 2016.']",1.0,0.8712024673513784,0.038461538461538464
148,When is the sims mobile supposed to come out?,"The Sims Mobile is a life simulation game based on The Sims 4 and The Sims FreePlay for Android and iOS devices. The game was released worldwide on March 6, 2018, but was available for testing on the App Store and Google Play in Brazil on May 9, 2017. It features a multiplayer component and includes story elements.","['- (The Sims Mobile) The Sims Mobile is a life simulation game based on The Sims 4 and The Sims FreePlay for Android and iOS devices. The game was released worldwide on March 6, 2018, but was available for testing on the App Store and Google Play in Brazil on May 9, 2017. It features a multiplayer component and includes story elements.\r\n- (QA_1) When did The Sims Mobile release in Brazil? May 9, 2017.\r\n- (QA_2) When did The Sims Mobile release worldwide? March 6, 2018.']",1.0,0.6921745775253868,0.14285714285714285
149,When did we become the united states of america?,"The first documentary evidence of the phrase ""United States of America"" is from a letter dated January 2, 1776, written by Stephen Moylan, Esq., to George Washington's aide-de-camp and Muster-Master General of the Continental Army, Lt. Col. Joseph Reed. However, it wasn't until July 4, 1776 that the states declared themselves as ""United States of America"". On March 1, 1781 the United States of America established the United States in Congress Assembled as a governing body.","['- (QA_1) When, based on evidence, did we begin calling ourselves the united states of america? January 2, 1776.\r\n- (QA_2) When did we start becoming the united states of america by declaration? July 4, 1776.\r\n- (QA_3) When did we become the united states of america by establishing a central government? March 1, 1781.']",0.6,0.6871971478682001,0.5
150,Who runs the fbi office of professional responsibility?,"The Office of Professional Responsibility (OPR) is part of the United States Department of Justice (DOJ) responsible for investigating attorneys employed by the DOJ who have been accused of misconduct or crimes in their professional functions. Since September 2018, the OPR has been headed by Corey Amundson. Before Amundson, government official Robin Ashton worked in the OPR in the Department of Justice where she served as director from January 2011 to September 2018. Before Ashton, the OPR was headed by Mary Patrice Brown from 2009 to 2011.","['- (Office of Professional Responsibility) The Office of Professional Responsibility (OPR) is part of the United States Department of Justice (DOJ) responsible for investigating attorneys employed by the DOJ who have been accused of misconduct or crimes in their professional functions. Since September 2018, the OPR has been headed by Corey Amundson. Before Amundson, government official Robin Ashton worked in the OPR in the Department of Justice where she served as director from January 2011 to September 2018. Before Ashton, the OPR was headed by Mary Patrice Brown from 2009 to 2011.\r\n- (QA_1) Which department runs the fbi office of professional responsibility? DOJ, Department of Justice.\r\n- (QA_2) What individual runs the fbi office of professional responsibility since September 2018? Corey Amundson.\r\n- (QA_3) What individual ran the fbi office of professional responsibility from 2011-2018? Robin Ashton.']",1.0,0.7733996845805947,0.1
151,When do harvey and sabrina get back together?,"Sabrina the Teenage Witch is an American television sitcom created by Nell Scovell, based on the Archie Comics series of the same name. It features characters Sabrina Spellman and Harvey Kinkle, who have an on and off relationship throughout the series. The first time the couple gets back together is in season 3. The second time the couple start dating again is in season 4 episode 9, after which they share a nice Thanksgiving dinner with Sabrina's aunts and the Pilgrims they conjured up to do the cooking. The third time and final time they get back together is in season 7 episode 22, when they kiss and ride away together on Harvey's motorcycle.","[""- (Sabrina the Teenage Witch (1996 TV series)) Sabrina the Teenage Witch is an American television sitcom created by Nell Scovell, based on the Archie Comics series of the same name. It features characters Sabrina Spellman and Harvey Kinkle, who have an on and off relationship throughout the series. The first time the couple gets back together is in season 3. The second time the couple start dating again is in season 4 episode 9, after which they share a nice Thanksgiving dinner with Sabrina's aunts and the Pilgrims they conjured up to do the cooking. The third time and final time they get back together is in season 7 episode 22, when they kiss and ride away together on Harvey's motorcycle.\r\n- (QA_1) When is the first time that Harvey and Sabrina get back together? Season 3.\r\n- (QA_2) When is the second time that Harvey and Sabrina get back together? Season 4 Episode 9.\r\n- (QA_3) When is the third time that Harvey and Sabrina get back together? Season 7 Episode 22.""]",1.0,0.9085309731340137,0.2727272727272727
